{
  "schema_version": 1,
  "spec_version": "0.1.0",
  "outcome_vocabulary": [
    {
      "id": "success",
      "description": "The canonical operation completed and its result or terminal outcome is valid."
    },
    {
      "id": "unsupported",
      "description": "The adapter does not provide the canonical operation."
    },
    {
      "id": "invalid-request",
      "description": "The canonical input violates the operation contract."
    },
    {
      "id": "host-failure",
      "description": "The host rejected or could not complete the operation."
    },
    {
      "id": "disconnected",
      "description": "The caller connection became unusable."
    }
  ],
  "contracts": [
    {
      "operation": "terminal.write",
      "title": "Terminal write",
      "description": "Write the requested bytes or text to the caller terminal.",
      "category": "terminal",
      "normative_behavior": [
        "The adapter SHALL write the supplied data in order to the caller terminal.",
        "The adapter SHALL normalize the host encoding at the ODS boundary.",
        "The adapter SHALL surface a disconnected outcome when the caller connection is unusable."
      ],
      "inputs": [
        {
          "name": "data",
          "description": "Bytes or text to write to the caller terminal."
        }
      ],
      "output": {
        "result": "void",
        "description": "No value is returned after a successful write."
      },
      "outcomes": ["success", "unsupported", "invalid-request", "host-failure", "disconnected"],
      "unsupported_behavior": "The adapter SHALL report unsupported without fabricating terminal output.",
      "lifecycle": {
        "normal_completion": "The operation does not terminate the session.",
        "disconnect": "The adapter SHALL stop the write and enter lifecycle.disconnect.",
        "carrier_loss": "Carrier loss SHALL be surfaced as disconnected when detected during the write.",
        "implementation_shutdown": "Implementation shutdown MUST NOT be reported as a successful write."
      },
      "implementation_obligations": [
        "Preserve data order and canonical text semantics.",
        "Do not silently discard a host failure or disconnect."
      ],
      "compatibility_notes": []
    },
    {
      "operation": "terminal.read_key",
      "title": "Terminal key input",
      "description": "Wait for and return one terminal input unit.",
      "category": "terminal",
      "normative_behavior": [
        "The adapter SHALL wait for one input unit when the connection remains usable.",
        "The returned key SHALL preserve the canonical input meaning rather than a host-specific code.",
        "The adapter SHALL surface a disconnected outcome when the caller connection is unusable."
      ],
      "inputs": [],
      "output": {
        "result": "key",
        "description": "The canonical input unit received from the caller."
      },
      "outcomes": ["success", "unsupported", "invalid-request", "host-failure", "disconnected"],
      "unsupported_behavior": "The adapter SHALL report unsupported without blocking for input.",
      "lifecycle": {
        "normal_completion": "The operation returns one key and leaves the session active.",
        "disconnect": "The adapter SHALL stop waiting and enter lifecycle.disconnect.",
        "carrier_loss": "Carrier loss SHALL be surfaced as disconnected rather than as a key.",
        "implementation_shutdown": "Implementation shutdown MUST NOT be represented as input."
      },
      "implementation_obligations": [
        "Do not reinterpret a disconnect or host failure as ordinary input.",
        "Preserve the canonical distinction between a key and a line."
      ],
      "compatibility_notes": []
    },
    {
      "operation": "terminal.read_line",
      "title": "Terminal line input",
      "description": "Read an edited line of terminal input.",
      "category": "terminal",
      "normative_behavior": [
        "The adapter SHALL read one line subject to the supplied maximum length.",
        "The adapter SHALL preserve the canonical text result and its editing boundary.",
        "The adapter SHALL surface a disconnected outcome when the caller connection is unusable."
      ],
      "inputs": [
        {
          "name": "max_length",
          "description": "Maximum canonical length accepted for the line."
        }
      ],
      "output": {
        "result": "text",
        "description": "The edited line of caller input."
      },
      "outcomes": ["success", "unsupported", "invalid-request", "host-failure", "disconnected"],
      "unsupported_behavior": "The adapter SHALL report unsupported without entering a line-input wait.",
      "lifecycle": {
        "normal_completion": "The operation returns one line and leaves the session active.",
        "disconnect": "The adapter SHALL stop line input and enter lifecycle.disconnect.",
        "carrier_loss": "Carrier loss SHALL be surfaced as disconnected rather than an incomplete successful line.",
        "implementation_shutdown": "Implementation shutdown MUST NOT be reported as line input."
      },
      "implementation_obligations": [
        "Reject an invalid maximum length deterministically.",
        "Do not silently convert disconnect into end-of-line success."
      ],
      "compatibility_notes": [
        "Editing behavior is part of the host adapter contract, not a language-specific API."
      ]
    },
    {
      "operation": "session.identity",
      "title": "Session identity",
      "description": "Return stable caller identity fields available from the host.",
      "category": "session",
      "normative_behavior": [
        "The adapter SHALL return the identity fields that the host can establish.",
        "Opaque identifiers SHALL NOT be renumbered by the adapter."
      ],
      "inputs": [],
      "output": {
        "result": "identity",
        "description": "Canonical caller identity fields and opaque identifiers."
      },
      "outcomes": ["success", "unsupported", "host-failure"],
      "unsupported_behavior": "The adapter SHALL report unsupported when the host cannot provide the canonical identity operation.",
      "lifecycle": {
        "normal_completion": "The operation returns identity data without terminating the session.",
        "disconnect": "A disconnect observed while obtaining identity SHALL enter lifecycle.disconnect.",
        "carrier_loss": "Carrier loss is not identity data and SHALL be surfaced as disconnected when observed.",
        "implementation_shutdown": "Implementation shutdown MUST NOT be reported as identity data."
      },
      "implementation_obligations": [
        "Preserve opaque user and node identifiers.",
        "Distinguish unavailable identity from a fabricated identity value."
      ],
      "compatibility_notes": []
    },
    {
      "operation": "session.node",
      "title": "Session node",
      "description": "Return the host node identifier for the door session.",
      "category": "session",
      "normative_behavior": [
        "The adapter SHALL return the node identifier established for the session.",
        "The node identifier SHALL remain opaque at the ODS boundary."
      ],
      "inputs": [],
      "output": {
        "result": "node",
        "description": "The opaque host node identifier for this session."
      },
      "outcomes": ["success", "unsupported", "host-failure"],
      "unsupported_behavior": "The adapter SHALL report unsupported when no host node identifier is available.",
      "lifecycle": {
        "normal_completion": "The operation returns the node identifier without terminating the session.",
        "disconnect": "A disconnect observed while obtaining the node SHALL enter lifecycle.disconnect.",
        "carrier_loss": "Carrier loss is not a node identifier and SHALL be surfaced as disconnected when observed.",
        "implementation_shutdown": "Implementation shutdown MUST NOT be reported as a node identifier."
      },
      "implementation_obligations": [
        "Do not renumber or infer a node identifier from a host name.",
        "Report host failure when the node cannot be established."
      ],
      "compatibility_notes": []
    },
    {
      "operation": "session.time_left",
      "title": "Session time left",
      "description": "Return remaining session time in seconds when known.",
      "category": "session",
      "normative_behavior": [
        "The adapter SHALL report remaining time in canonical seconds when the host provides it.",
        "The adapter SHALL normalize host units before returning a result."
      ],
      "inputs": [],
      "output": {
        "result": "seconds",
        "description": "Remaining session time expressed in canonical seconds."
      },
      "outcomes": ["success", "unsupported", "host-failure"],
      "unsupported_behavior": "The adapter SHALL report unsupported when remaining time is not available or cannot be normalized.",
      "lifecycle": {
        "normal_completion": "The operation returns remaining time without terminating the session.",
        "disconnect": "A disconnect observed while obtaining time SHALL enter lifecycle.disconnect.",
        "carrier_loss": "Carrier loss is not a time value and SHALL be surfaced as disconnected when observed.",
        "implementation_shutdown": "Implementation shutdown MUST NOT be reported as remaining time."
      },
      "implementation_obligations": [
        "Convert host units to seconds without silently changing meaning.",
        "Do not invent remaining time when the host does not expose it."
      ],
      "compatibility_notes": [
        "A host value in another unit requires an explicit normalization step."
      ]
    },
    {
      "operation": "session.connection_state",
      "title": "Session connection state",
      "description": "Report whether the remote caller connection remains usable.",